Key	EN	FR
basic-info-title	Quick situation overview	Bilan d'ambiance
basic-info-desc	You take sometime to evaluate the situation	Vous prenez le temps d'√©valuer la situation
basic-info-feedback	You take a quick tour of the scene. A passenger bus has overturned after hitting an obstacle. You estimate the number of victims at between 15 and 25.	Vous faites un rapide tour de la sc√®ne. Il s‚Äôagit d‚Äôun accident d‚Äôun car de voyageur qui s‚Äôest renvers√© apr√®s avoir heurt√© un obstacle. Vous √©valuez le nombre de victimes entre 15 et 25.
other-basic-info-title	Get information from passerby	Obtenir de l'information d'un passant
other-basic-info-desc	Take a minute to listen to a passerby that comes up to you and wants to tell you something seemingly important.	"Prendre le temps d'√©couter ce qu'un passant a √† vous dire, apparemment quelque chose d'important."
other-basic-info-feedback	The passer-by seems to be in a state of shock. He didn't see what happened.	Le passant semble en √©tat de choc. Il n'a pas vu ce qui s'est pass√©.
basic-info-police-title	Get police information	Obtenir des informations de la police
basic-info-police-desc	You approach a nearby police car to get some more information about the situation	Vous approchez d'une voiture de police pour obtenir des informations
basic-info-police-feedback	Police are informing you that rue de Lausanne is now closed to traffic in both directions.	La police vous informe que la rue de Lausanne est maintenant coup√©e √† la circulation dans les deux sens.
basic-info-firefighter-title	Get firefighter information	Obtenir des informations des pompiers
basic-info-firefighter-desc	You approach a firefighter truck to get information.	Vous vous approchez d'un camion pompier pour obtenir des informations.
basic-info-firefighter-feedback	"Firefighters were only able to evacuate 5 people from the bus, which now has to be shored up and extricated. It will be 20 minutes before any more people can be removed from the bus.  "	"Les pompiers n‚Äôont pu √©vacuer que 5 personnes du car, qui doit maintenant √™tre √©tay√© et une d√©sincarc√©ration est √† pr√©voir. Il faudra 20 minutes avant que d‚Äôautres personnes ne puissent √™tre sorties du car. "
define-PC-title	Define command post location	Placer le poste de commandement
define-PC-desc	Pick a position on the map for your command post	D√©finir l'emplacement du poste de commandement sur la carte
define-PC-feedback	The command post is now ready	Le post de commandement est maintenant pr√™t
define-Nest-title	Define survivor reception center location	Placer le nid de bless√©s
define-Nest-desc	Pick a position on the map for the survivor reception center	D√©finir l'emplacement du nid de bless√©s sur la carte
define-Nest-feedback	The survivor reception center is now defined	Le nid de bless√© est maintenant plac√©
define-PMA-title	Define advanced medical post location	Placer le poste m√©dical avanc√© (PMA)
define-PMA-desc	Pick a location on the map for the advanced medical post	D√©finir l'emplacement du poste m√©dical avanc√© (PMA) sur la carte
define-PMA-feedback	The advanced medical post can now be prepared	Le poste m√©dical avanc√© (PMA) est pr√™t √† √™tre install√©
define-sectors-title	Sectorize incident area	Sectoriser la zone de l'incident
define-sectors-desc	Define the different sectors of the incident site in readiness for pr√©triage	Sectoriser les zones du chantier en vue du pr√©-triage
define-sectors-feedback	You successfully defined sectors of the incident. New pr√©tri tasks are available in the resources section	Vous avez d√©fini les secteurs du chantier. Des nouvelles t√¢ches de pr√©tri sont disponibles dans l'onglet ressources
casu-message-title	Send message to CASU	Envoyer message à CASU
casu-message-title-MET	Send MET	Envoi du MET
casu-message-title-HANE	Send HANE	Envoi du HANE
casu-message-title-E	Send E	Envoi du E
casu-message-title-METHANE	Send METHANE	Envoi du METHANE
casu-message-desc	Send a METHANE radio message to emergency 	Envoyer un message METHANE √† CASU
casu-message-feedback	"We got your METHANE message, the ACS and MCS are their way"	"Message METHANE bien re√ßu, l'ACS et le MCS sont en route"
methane-acs-arrived	You have arrived at the incident site	Vous √™tes arriv√© sur les lieux de l'accident
methane-mcs-arrived	You have arrived at the incident site	Vous √™tes arriv√© sur les lieux de l'accident
send-resources-title	Send resources	Envoyer des ressources
send-resources-desc	Transfer some of your resources to another actor	Transf√©rer certaines de vos ressources √† un autre acteur
send-resources-feedback	You received resources	Vous avez re√ßu des ressources
assign-task-title	Assign a task	Assigner une t√¢che
assign-task-desc	Assign resources to a task	Assigner des ressources √† une t√¢che
assign-task-feedback	You assigned resources to a task	Vous avez assign√© des ressources √† une t√¢che
release-task-title	Release resources	Lib√©rer des ressources
release-task-desc	Release resources from a task	Lib√®re des ressources d'une t√¢che
release-task-feedback	You released resources from a task	Vous avez lib√©r√© des ressources
ask-reinforcement-title	Ask CASU for reinforcements 	Demande de renforts √† CASU
ask-reinforcement-desc	Call the emergency center and ask for more resources on site	Appeler CASU pour demander plus de renforts sur site
ask-reinforcement-feedback	CASU : we are now sending 5 resources	CASU : Nous envoyons 5 resources suppl√©mentaires pour vous
pre-tri-zone-A-title	Pretriage of zone A	Pr√©triage de la zone A
pre-tri-zone-A-desc	Send resources to perform pretriage of zone A	Envoyer des resources pr√©trier la zone A
pre-tri-zone-A-feedback	"The pretriage of zone A is done. 5 red, 10 yellow, 5 green"	"Pr√©triage de la zone A termin√©. 5 rouges, 10 jaunes, 5 verts"
pre-tri-zone-B-title	Pretriage of zone B	Pr√©triage de la zone B
pre-tri-zone-B-desc	Send resources to perform pr√©triage of zone B	Envoyer des resources pr√©trier la zone B
pre-tri-zone-B-feedback	"The pr√©triage of zone B is done. 5 red, 10 yellow, 5 green"	"Pr√©triage de la zone B termin√©. 5 rouges, 10 jaunes, 5 verts"
on-the-road	On the way	En route