Key	EN	FR	
basic-info-title	Scene examination	Examen de la sc√®ne	
basic-info-desc	You take sometime to evaluate the situation	Vous prenez le temps d'√©valuer la situation	
basic-info-feedback	You take a quick tour of the scene. A passenger bus has overturned after hitting an obstacle. You estimate the number of victims at between 15 and 25. 	Vous faites un rapide tour de la sc√®ne. Il s‚Äôagit d‚Äôun accident d‚Äôun car de voyageur qui s‚Äôest renvers√© apr√®s avoir heurt√© un obstacle. Vous √©valuez le nombre de victimes entre 15 et 25. 	
other-basic-info-title	Get information from passerby	Obtenir de l'information d'un passant	
other-basic-info-desc	Take a minute to listen to a passerby that comes up to you and wants to tell you something seemingly important.	"Prendre le temps d'√©couter ce qu'un passant a √† vous dire, apparemment quelque chose d'important."	
other-basic-info-feedback	The passer-by seems to be in a state of shock. He didn't see what happened.	Le passant semble en √©tat de choc. Il n'a pas vu ce qui s'est pass√©.	
basic-info-police-title	Get police information	Obtenir des informations de la police	
basic-info-police-desc	You approach a nearby police car to get some more information about the situation	Vous approchez d'une voiture de police pour obtenir des informations	
basic-info-police-feedback	Police are informing you that rue de Lausanne is now closed to traffic in both directions.	La police vous informe que la rue de Lausanne est maintenant coup√©e √† la circulation dans les deux sens.	
basic-info-firefighter-title	Get firefighter information	Obtenir des informations des pompiers	
basic-info-firefighter-desc	You approach a firefighter truck to get information.	Vous vous approchez d'un camion pompier pour obtenir des informations.	
basic-info-firefighter-feedback	"Firefighters were only able to evacuate 5 people from the bus, which now has to be shored up and extricated. It will be 20 minutes before any more people can be removed from the bus."	"Les pompiers n‚Äôont pu √©vacuer que 5 personnes du car, qui doit maintenant √™tre √©tay√© et une d√©sincarc√©ration est √† pr√©voir. Il faudra 20 minutes avant que d‚Äôautres personnes ne puissent √™tre sorties du car."	
define-PC-title	Define command post location	Placer le poste de commandement	
define-PC-desc	Pick a position on the map for your command post	D√©finir l'emplacement du poste de commandement sur la carte	
define-PC-feedback	The command post is now ready	Le post de commandement est maintenant pr√™t	
define-Nest-title	Define survivor reception center location	Placer le nid de bless√©s	
define-Nest-desc	Pick a position on the map for the survivor reception center	D√©finir l'emplacement du nid de bless√©s sur la carte	
define-Nest-feedback	The survivor reception center is now defined	Le nid de bless√© est maintenant plac√©	
define-PMA-title	Deciding where to locate the advanced medical post	D√©cider de l‚Äôemplacement du poste m√©dical avanc√© (PMA)	
define-PMA-desc	Pick a location on the map for the advanced medical post	D√©cider de l'emplacement du poste m√©dical avanc√© (PMA) sur la carte	
define-PMA-feedback	The advanced medical post can now be prepared	Le poste m√©dical avanc√© (PMA) est pr√™t √† √™tre install√©	
define-accreg-title	Define access and egress routes	D√©finir les route d'acc√®s et d'√©vacuation.	
define-accreg-desc	Define the access and egress routes along that your resources will use.	D√©finir les route d'acc√®s et d'√©vacuation par lesquels les moyens engag√©s acc√®dent au site.	
define-accreg-feedback	You successfully defined access and regress routes for the incident. 	Vous avez d√©fini les routes d'acc√®s et d'√©vacuation du chantier.	
casu-message-title	Send message to CASU	Envoyer un message √† CASU	
casu-message-title-MET	Send MET	Envoi du MET	
casu-message-title-HANE	Send HANE	Envoi du HANE	
casu-message-title-E	Send E	Envoi du E	
casu-message-title-METHANE	Send METHANE	Envoie du METHANE	
casu-message-title-R	Request for hospital information	Demande d'informations sur hôpitaux	
casu-message-desc	Send a radio message to CASU 	Envoyer un message radio √† CASU	
actor-arrival	You have arrived at the incident site	Vous √™tes arriv√© sur les lieux de l'accident	
send-resources-title	Send resources	Envoyer des ressources	
send-resources-desc	Transfer some of your resources to another actor	Transf√©rer certaines de vos ressources √† un autre acteur	
send-resources-feedback	You received resources	Vous avez re√ßu des ressources	
assign-task-title	Assign a task	Assigner une t√¢che	
assign-task-desc	Assign resources to a task	Assigner des ressources √† une t√¢che	
assign-task-feedback	You assigned resources to a task	Vous avez assign√© des ressources √† une t√¢che	
release-task-title	Release resources	Rappeler des ressources	
release-task-desc	Release resources from a task	Rappelle des ressources d'une t√¢che	
release-task-feedback	You released resources from a task	Vous avez rappel√© des ressources	
on-the-road	On the way	En route	
pre-tri-title	Pre-triage	Pr√©-triage	
brancardage-title	Brancardage	Brancardage	
request-hospital-info	Request hospital informations	Demander informations sur hôpitaux	
request-resources	Request for resources	Demande de ressources	
pretriage-task-completed	Pre-triage done	Pr√©-triage termin√©	
porters-task-completed	Patients evacuation done	Brancardage termin√©	 
send-radio-title	Sends radio message	Envoie message radio	
send-radio-desc	Sends a radio message	Envoie un message radio	
send-radio-feedback	A radio message was sent	Un message radio a √©t√© envoy√©	
define-meetingPoint-title	Define meeting point	D√©finir le point de rassemblement	
define-meetingPoint-desc	Define the meeting point's location on the map	D√©cider de l'emplacement du point de rassemblement sur la carte.	
define-meetingPoint-feedback	You successfully defined the meeting point	Vous avez d√©fini avec succ√®s le point de rassemblement	
move-actor-title	Move to another location	Se d√©placer	
move-actor-desc	Move your role to one of the available location on the map	D√©place votre r√¥le √† un emplacement disponible sur la carte	
move-actor-feedback	You moved	Vous vous √™tes d√©plac√©	
appoint-EVASAN-title	Appoint EVASAN	Nommer EVASAN	
appoint-EVASAN-desc	You appoint an ambulancier as EVASAN 	Vous nommez un ambulancier comme EVASAN	
appoint-EVASAN-feedback	You appointed an EVASAN	Vous avez nomm√© un EVASAN	
appoint-EVASAN-wentWrong-feedback	You could not appoint an EVASAN	Vous n'avez pas pu nommer un EVASAN	
define-acsMscArrival-title	Assume ACS/MCS duties	Prendre la responsabilit√© ACS/MCS	
define-acsMscArrival-desc	You take the responsibility as ACS and MCS	Vous prenez la responsabilit√© des r√¥les d'ACS et MCS	
define-acsMscArrival-feedback	You announced taking responsibilities as ACS and MCS	Vous avez annonc√© prendre la responsabilit√© des r√¥les d'ACS et MCS	
waiting-title	Waiting	En attente	
currentActivity	Current Activity	Activit√© en cours	
targetActivity	Target Activity	Activit√© √† destination	
move-res-task-title	Assign resource	Assigner ressource	
move-res-task-desc	Move resources to given location and task	D√©placer ressources √† l'endroit et t√¢che choisie	
move-res-task-feedback	The resources have been sucessfuly reassigned	Les ressources ont √©t√© assign√©s avec succ√©s	
move-res-task-refused	The resources have refused your orders	Les ressources ont refus√© votre ordre	
get-hospital-information-desc	Ask CASU to obtain and compile available hospital places at requested geographical level	Demander à la CASU d'obtenir et de compiler les places hospitalières disponibles au niveau géographique demandé	